{
  "config_id": "structured_explanation_config_v1",
  "config_version": "structured_explanation_config_v1",
  "registry_version": "canonical_dimension_registry_v1",
  "status": "provisional",
  "calibration_status": "uncalibrated",
  "runtime_status": "offline_only",
  "production_approval_status": "not_approved",
  "scientifically_validated": false,
  "maximum_total_signals": 12,
  "maximum_signals_per_category": 3,
  "maximum_signals_per_module": 2,
  "minimum_signal_confidence": 0.25,
  "high_confidence_threshold": 0.75,
  "moderate_confidence_threshold": 0.5,
  "structural_close_threshold": 0.2,
  "structural_difference_threshold": 0.45,
  "preference_strong_fit_threshold": 0.8,
  "preference_weak_fit_threshold": 0.4,
  "value_strong_fit_threshold": 0.8,
  "value_weak_fit_threshold": 0.4,
  "asymmetry_reporting_threshold": 0.25,
  "score_difference_tolerance": 1e-09,
  "soft_conflict_reporting_bands": ["low", "moderate", "high"],
  "missing_evidence_reporting_policy": "emit_distinct_codes_capped",
  "hard_constraint_reporting_policy": "failed_first_then_unknown_then_passed_then_not_applicable",
  "confidence_adjustment_reporting_policy": "emit_when_scores_differ_beyond_tolerance",
  "deduplication_policy": "code_source_field_direction",
  "diversity_policy": "prefer_both_supportive_and_cautionary_when_available",
  "tie_breaking_policy": "blocking_salience_confidence_category_component_display_signal_id",
  "localization_mode": "structured_code_and_parameters",
  "ai_generation_status": "prohibited",
  "persona_input_status": "prohibited",
  "frequency_type_status": "prohibited",
  "complementarity_status": "disabled",
  "version_compatibility_policy": "require_matching_registry_version",
  "category_priority": [
    "hard_constraint",
    "overall_status",
    "confidence_adjustment",
    "evidence_limitation",
    "missing_information",
    "measured_difference",
    "soft_conflict",
    "partner_preference_fit",
    "relationship_value_alignment",
    "strong_alignment",
    "directional_asymmetry",
    "production_limitation"
  ],
  "source_component_order": [
    "hard_constraint",
    "iq_structural",
    "eq_structural",
    "frequency_structural",
    "mutual_partner_preference",
    "mutual_relationship_values",
    "aggregation",
    "evidence_coverage"
  ],
  "notes": {
    "thresholds_are_provisional": true,
    "pending_user_research": true,
    "do_not_use_for_production_ranking": true,
    "structural_salience_uses_normalized_effective_weight_times_magnitude_only": true
  }
}
